{
  "title": "About APTlantis",
  "slug": "about",
  "summary": "APTlantis is a unified open-source archive, mirror network, and automation platform that preserves software ecosystems, datasets, and cultural knowledge while empowering developers with fast, reliable access to information.",

  "mission": "APTlantis exists to preserve open knowledge and make it permanently accessible. Through a fusion of mirrors, datasets, automation pipelines, and AI-driven metadata systems, APTlantis creates a stable, verifiable, and future-proof library of modern software ecosystems and digital culture. The project is built on transparency, open tooling, and the belief that long-term access to information should be simple, fast, and freely available.",

  "content_sections": [
    {
      "heading": "What APTlantis Is",
      "body": "APTlantis is a hybrid platform combining public mirrors, curated datasets, and intelligent automation. It hosts operating system repositories, language package archives, specialized datasets, torrent rescues, historical collections, and live dashboards powered by real metadata. APTlantis emphasizes redundancy, validation, and open data formats to ensure that knowledge remains available long after original sources disappear."
    },
    {
      "heading": "A Unified Storage & Mirror Network",
      "body": "APTlantis syncs and hosts more than 55 Linux distributions and dozens of programming-language ecosystems, including CPAN, Hackage, PyPI top packages, Flathub refs, and specialized archives like TempleOS collections and Rust crate indexes. All repositories are mirrored through high-performance servers and made accessible via HTTP, rsync, and internal automation workers."
    },
    {
      "heading": "Built for Longevity",
      "body": "Everything is designed with preservation in mind. Files are validated using multi-hash verification, manifests are auto-generated, and metadata is normalized into JSON-LD, TOML, CSV, and other open formats. If an upstream source vanishes, APTlantis keeps the knowledge alive."
    },
    {
      "heading": "Automation & AI-Assisted Infrastructure",
      "body": "APTlantis is powered by a custom ecosystem of automation agents and 'LLM Secretaries' that watch directories, analyze datasets, generate metadata, summarize project states, and orchestrate pipelines. The system includes fine-tuning workflows, dataset scrapers, torrent reconstruction tools, and scanners that classify, validate, or rebuild archives."
    },
    {
      "heading": "Developer-Focused Philosophy",
      "body": "APTlantis is built with the mindset of a hobbyist developer who values practicality, transparency, and open-source ethics. The entire platform is designed so that a single individual can effectively maintain a massive, complex archival system using smart tooling, AI helpers, and automation rather than a large team."
    },
    {
      "heading": "Why It Matters",
      "body": "Software ecosystems move fast—sometimes too fast for their own good. When a distribution dies, an API shuts down, or a repository is abandoned, entire generations of code can evaporate. APTlantis prevents that loss. It ensures that researchers, developers, archivists, and future explorers can still access the building blocks of open knowledge decades from now."
    }
  ],

  "faq": [
    {
      "question": "What does APTlantis actually host?",
      "answer": "APTlantis maintains a collection of operating-system mirrors, package repositories, programming-language ecosystems, and specialized datasets. It also stores metadata, manifest files, torrent reconstructions, and archival snapshots of software ecosystems.",
      "tags": ["mirrors", "datasets"]
    },
    {
      "question": "Is everything open source?",
      "answer": "Yes. APTlantis focuses exclusively on open-source software, freely distributable datasets, public domain works, and material that is legally shareable under permissive licensing. Anything proprietary or unclear is excluded by default.",
      "tags": ["ethics", "policy"]
    },
    {
      "question": "Why does APTlantis exist?",
      "answer": "To preserve ecosystems, prevent bit-rot, and give developers fast access to reliable, long-term mirrors. Many projects vanish over time; APTlantis makes sure their knowledge doesn't.",
      "tags": ["philosophy", "mission"]
    },
    {
      "question": "How is APTlantis maintained?",
      "answer": "The system is built to be maintainable by a single operator through automation pipelines, AI agents, file watchers, and standardized schemas. Hardware includes a home server fleet, remote dedibox servers, and cloud-tunneled endpoints handled through Caddy and Cloudflare.",
      "tags": ["automation", "infrastructure"]
    },
    {
      "question": "Can I access the mirrors openly?",
      "answer": "Yes. All public mirrors are accessible via HTTP and rsync, and the platform exposes human-friendly browsing interfaces and machine-readable metadata schemas.",
      "tags": ["access", "usage"]
    },
    {
      "question": "Does APTlantis track users or collect data?",
      "answer": "No. APTlantis does not track usage, log personal data, or require authentication for public mirrors. Privacy is a core design requirement.",
      "tags": ["privacy"]
    }
  ],

  "contact": {
    "email": "contact@aptlantis.net",
    "url": "https://aptlantis.net",
    "note": "For general inquiries, collaboration, or dataset submissions."
  },

  "credits": [
    {
      "name": "Herb",
      "role": "Founder, Developer, Architect",
      "url": "https://aptlantis.net"
    },
    {
      "name": "Open-Source Communities",
      "role": "Upstream maintainers, contributors, and mirror operators"
    }
  ],

  "jsonld": {
    "@context": "https://schema.org",
    "@type": "WebSite",
    "name": "APTlantis",
    "description": "An open-source archive and mirror platform preserving software ecosystems and datasets.",
    "url": "https://aptlantis.net"
  },

  "ai": {
    "summary_prompt": "Summarize APTlantis as an open-source archive, mirror network, and automation platform designed for long-term preservation of software ecosystems and datasets.",
    "faq_generation_prompt": "Generate helpful, concise FAQs explaining APTlantis, its infrastructure, how mirrors work, and how automation supports preservation.",
    "tone": "professional, technical, friendly"
  }
}
